{
 "schema_version": "edit-plan.v1",
 "generated_at": "2026-08-17T08:52:24.941367Z",
 "benchmark_id": "last-spring-quarter-class-auto-planning-v1",
 "concept_id": "concept_ultimo_dia_clases",
 "revision": 1,
 "project": {
  "width": 1080,
  "height": 1920,
  "fps": 30,
  "duration_seconds": 78.27,
  "background_color": "#000000"
 },
 "tracks": [
  {
   "track_id": "v1",
   "kind": "video",
   "events": [
    {
     "event_id": "v01_failed_intros",
     "asset_id": "img_2539",
     "source_start_seconds": 12.99,
     "source_end_seconds": 15.3,
     "timeline_start_seconds": 0.0,
     "duration_seconds": 2.31,
     "playback_rate": 1.0,
     "intent": "Establecer el tono divertido y aut\u00e9ntico, mostrando los intentos fallidos de arrancar el vlog.",
     "observed_content": "El hombre se pone la mochila y habla directamente a la c\u00e1mara. Audio: '\u00bfQu\u00e9 onda?'",
     "confidence": 0.95,
     "transition_out": {
      "type": "cut",
      "duration_seconds": 0.0
     },
     "text": null,
     "reframe": {
      "mode": "fit",
      "center_x": 0.5,
      "center_y": 0.5,
      "scale": 1.0,
      "rotation_degrees": 0,
      "manual_review": false
     },
     "volume_db": null
    },
    {
     "event_id": "v02_failed_intros",
     "asset_id": "img_2540",
     "source_start_seconds": 3.37,
     "source_end_seconds": 5.23,
     "timeline_start_seconds": 2.31,
     "duration_seconds": 1.86,
     "playback_rate": 1.0,
     "intent": "Establecer el tono divertido y aut\u00e9ntico, mostrando los intentos fallidos de arrancar el vlog.",
     "observed_content": "El hombre se cuelga la mochila al hombro y sonr\u00ede directamente a la c\u00e1mara. Audio: '\u00bfQu\u00e9 onda?'",
     "confidence": 0.95,
     "transition_out": {
      "type": "cut",
      "duration_seconds": 0.0
     },
     "text": null,
     "reframe": {
      "mode": "fit",
      "center_x": 0.5,
      "center_y": 0.5,
      "scale": 1.0,
      "rotation_degrees": 0,
      "manual_review": false
     },
     "volume_db": null
    },
    {
     "event_id": "v03_failed_intros",
     "asset_id": "img_2541",
     "source_start_seconds": 3.8,
     "source_end_seconds": 5.75,
     "timeline_start_seconds": 4.17,
     "duration_seconds": 1.95,
     "playback_rate": 1.0,
     "intent": "Establecer el tono divertido y aut\u00e9ntico, mostrando los intentos fallidos de arrancar el vlog.",
     "observed_content": "El sujeto se pone la mochila y se dirige directamente a la c\u00e1mara.",
     "confidence": 0.95,
     "transition_out": {
      "type": "cut",
      "duration_seconds": 0.0
     },
     "text": null,
     "reframe": {
      "mode": "fit",
      "center_x": 0.5,
      "center_y": 0.5,
      "scale": 1.0,
      "rotation_degrees": 0,
      "manual_review": false
     },
     "volume_db": null
    },
    {
     "event_id": "v04_failed_intros",
     "asset_id": "img_2544",
     "source_start_seconds": 8.82,
     "source_end_seconds": 14.52,
     "timeline_start_seconds": 6.12,
     "duration_seconds": 5.7,
     "playback_rate": 1.0,
     "intent": "Establecer el tono divertido y aut\u00e9ntico, mostrando los intentos fallidos de arrancar el vlog.",
     "observed_content": "Toma exitosa: '\u00bfQu\u00e9 onda? Acomp\u00e1\u00f1enme a una de mis \u00faltimas clases de primavera ac\u00e1 a Stanford y voy a comer primero.'",
     "confidence": 0.92,
     "transition_out": {
      "type": "cut",
      "duration_seconds": 0.0
     },
     "text": null,
     "reframe": {
      "mode": "fit",
      "center_x": 0.5,
      "center_y": 0.5,
      "scale": 1.0,
      "rotation_degrees": 0,
      "manual_review": false
     },
     "volume_db": null
    },
    {
     "event_id": "v05_cafeteria",
     "asset_id": "img_2547",
     "source_start_seconds": 5.5,
     "source_end_seconds": 7.5,
     "timeline_start_seconds": 11.82,
     "duration_seconds": 2.0,
     "playback_rate": 1.0,
     "intent": "Mostrar la pausa para comer y la interacci\u00f3n social con un amigo en la cafeter\u00eda.",
     "observed_content": "La c\u00e1mara se estabiliza e inclina hacia arriba para revelar claramente el entorno principal de la cafeter\u00eda.",
     "confidence": 0.95,
     "transition_out": {
      "type": "cut",
      "duration_seconds": 0.0
     },
     "text": null,
     "reframe": {
      "mode": "fit",
      "center_x": 0.5,
      "center_y": 0.5,
      "scale": 1.0,
      "rotation_degrees": 0,
      "manual_review": false
     },
     "volume_db": null
    },
    {
     "event_id": "v06_cafeteria",
     "asset_id": "img_2547",
     "source_start_seconds": 109.28,
     "source_end_seconds": 112.28,
     "timeline_start_seconds": 13.82,
     "duration_seconds": 3.0,
     "playback_rate": 1.0,
     "intent": "Mostrar la pausa para comer y la interacci\u00f3n social con un amigo en la cafeter\u00eda.",
     "observed_content": "Primer plano de la mano usando pinzas para servir papas del buffet.",
     "confidence": 0.95,
     "transition_out": {
      "type": "cut",
      "duration_seconds": 0.0
     },
     "text": null,
     "reframe": {
      "mode": "fit",
      "center_x": 0.5,
      "center_y": 0.5,
      "scale": 1.0,
      "rotation_degrees": 0,
      "manual_review": false
     },
     "volume_db": null
    },
    {
     "event_id": "v07_cafeteria",
     "asset_id": "img_2547",
     "source_start_seconds": 114.28,
     "source_end_seconds": 116.28,
     "timeline_start_seconds": 16.82,
     "duration_seconds": 2.0,
     "playback_rate": 1.0,
     "intent": "Mostrar la pausa para comer y la interacci\u00f3n social con un amigo en la cafeter\u00eda.",
     "observed_content": "La comida se suelta de las pinzas sobre el plato.",
     "confidence": 0.95,
     "transition_out": {
      "type": "cut",
      "duration_seconds": 0.0
     },
     "text": null,
     "reframe": {
      "mode": "fit",
      "center_x": 0.5,
      "center_y": 0.5,
      "scale": 1.0,
      "rotation_degrees": 0,
      "manual_review": false
     },
     "volume_db": null
    },
    {
     "event_id": "v08_cafeteria",
     "asset_id": "img_2547",
     "source_start_seconds": 163.91,
     "source_end_seconds": 170.91,
     "timeline_start_seconds": 18.82,
     "duration_seconds": 7.0,
     "playback_rate": 1.0,
     "intent": "Mostrar la pausa para comer y la interacci\u00f3n social con un amigo en la cafeter\u00eda.",
     "observed_content": "C\u00e1mara se acerca a una mesa en la cafeter\u00eda; un hombre sentado mira su tel\u00e9fono; una mano entra en cuadro para recoger un plato de comida.",
     "confidence": 0.95,
     "transition_out": {
      "type": "cut",
      "duration_seconds": 0.0
     },
     "text": null,
     "reframe": {
      "mode": "fit",
      "center_x": 0.5,
      "center_y": 0.5,
      "scale": 1.0,
      "rotation_degrees": 0,
      "manual_review": false
     },
     "volume_db": null
    },
    {
     "event_id": "v09_cafeteria",
     "asset_id": "img_2547",
     "source_start_seconds": 176.72,
     "source_end_seconds": 178.72,
     "timeline_start_seconds": 25.82,
     "duration_seconds": 2.0,
     "playback_rate": 1.0,
     "intent": "Mostrar la pausa para comer y la interacci\u00f3n social con un amigo en la cafeter\u00eda.",
     "observed_content": "El hombre sentado mira directamente a la c\u00e1mara, sonr\u00ede y se r\u00ede.",
     "confidence": 0.95,
     "transition_out": {
      "type": "cut",
      "duration_seconds": 0.0
     },
     "text": null,
     "reframe": {
      "mode": "fit",
      "center_x": 0.5,
      "center_y": 0.5,
      "scale": 1.0,
      "rotation_degrees": 0,
      "manual_review": false
     },
     "volume_db": null
    },
    {
     "event_id": "v10_cafeteria",
     "asset_id": "img_2548",
     "source_start_seconds": 44.99,
     "source_end_seconds": 46.49,
     "timeline_start_seconds": 27.82,
     "duration_seconds": 1.5,
     "playback_rate": 1.0,
     "intent": "Mostrar la pausa para comer y la interacci\u00f3n social con un amigo en la cafeter\u00eda.",
     "observed_content": "El hombre sonr\u00ede ampliamente y se r\u00ede entre dientes mientras mira hacia el hablante.",
     "confidence": 0.95,
     "transition_out": {
      "type": "cut",
      "duration_seconds": 0.0
     },
     "text": null,
     "reframe": {
      "mode": "fit",
      "center_x": 0.5,
      "center_y": 0.5,
      "scale": 1.0,
      "rotation_degrees": 0,
      "manual_review": false
     },
     "volume_db": null
    },
    {
     "event_id": "v11_cafeteria",
     "asset_id": "img_2548",
     "source_start_seconds": 92.87,
     "source_end_seconds": 94.37,
     "timeline_start_seconds": 29.32,
     "duration_seconds": 1.5,
     "playback_rate": 1.0,
     "intent": "Mostrar la pausa para comer y la interacci\u00f3n social con un amigo en la cafeter\u00eda.",
     "observed_content": "El hombre hace un gesto prominente de doble pulgar hacia arriba mientras mira hacia la c\u00e1mara.",
     "confidence": 0.95,
     "transition_out": {
      "type": "cut",
      "duration_seconds": 0.0
     },
     "text": null,
     "reframe": {
      "mode": "fit",
      "center_x": 0.5,
      "center_y": 0.5,
      "scale": 1.0,
      "rotation_degrees": 0,
      "manual_review": false
     },
     "volume_db": null
    },
    {
     "event_id": "v12_classes",
     "asset_id": "img_2549",
     "source_start_seconds": 0.16,
     "source_end_seconds": 2.86,
     "timeline_start_seconds": 30.82,
     "duration_seconds": 2.7,
     "playback_rate": 1.0,
     "intent": "Mostrar la parte acad\u00e9mica del d\u00eda: la clase de deep learning y el seminario Transformers United.",
     "observed_content": "La c\u00e1mara se inclina hacia arriba y se detiene para mostrar claramente toda la sala de conferencias, el escenario y la pantalla de proyecci\u00f3n.",
     "confidence": 0.9,
     "transition_out": {
      "type": "cut",
      "duration_seconds": 0.0
     },
     "text": null,
     "reframe": {
      "mode": "fit",
      "center_x": 0.5,